subj,prop,obj,question,answers_list,s_pop,o_pop
Beyond Belief,producer,Beth Murphy,Who was the producer of Beyond Belief?,['Beth Murphy'],120,234
Paid,producer,Sam Wood,Who was the producer of Paid?,"['Sam Wood', 'Samuel Grosvenor ""Sam"" Wood', 'Samuel Grosvenor Wood']",383,2483
Saturday Morning,producer,Hal Roach,Who was the producer of Saturday Morning?,['Hal Roach'],97,9198
Strangers May Kiss,producer,George Fitzmaurice,Who was the producer of Strangers May Kiss?,['George Fitzmaurice'],259,760
The Rat,producer,Herbert Wilcox,Who was the producer of The Rat?,"['Herbert Wilcox', 'Herbert Sydney Wilcox']",134,1216
Parade of the Award Nominees,producer,Walt Disney,Who was the producer of Parade of the Award Nominees?,"['Walt Disney', 'Walter Elias Disney', 'W. Disney', 'Walter E. Disney']",362,340441
Today,producer,Reza Mirkarimi,Who was the producer of Today?,['Reza Mirkarimi'],149,350
Calendar,producer,Atom Egoyan,Who was the producer of Calendar?,"['Atom Egoyan', 'Atom Yeghoyan']",408,8054
Storm,producer,David Winning,Who was the producer of Storm?,['David Winning'],211,862
My Love,producer,Linda Perry,Who was the producer of My Love?,['Linda Perry'],485,75282
The Era,producer,Jay Chou,Who was the producer of The Era?,"['Jay Chou', 'Zhou Jielun', 'Chou Chieh-lun', 'sheldon']",417,33295
The Jack-Knife Man,producer,King Vidor,Who was the producer of The Jack-Knife Man?,"['King Vidor', 'King Wallis Vidor']",232,8354
3 Minutes,producer,George Wang,Who was the producer of 3 Minutes?,"['Don Le', 'Don Pham Le', 'George Wang']",303,172
Mother and Child,producer,Carl Froelich,Who was the producer of Mother and Child?,"['Carl Froelich', 'Carl August Hugo Froelich']",63,373
Chrome,producer,Trey Bruce,Who was the producer of Chrome?,"['Dann Huff', 'Dann Lee Huff', 'Trey Bruce']",455,388
Linger,producer,Johnnie To,Who was the producer of Linger?,"['Johnnie To', 'Johnnie To Kei-fung']",246,4144
Amore e non amore,producer,Lucio Battisti,Who was the producer of Amore e non amore?,['Lucio Battisti'],203,4037
Shelter,producer,Jamie xx,Who was the producer of Shelter?,"['Jamie xx', 'Jamie Smith']",399,15820
Airport,producer,Anubhav Sinha,Who was the producer of Airport?,"['Anubhav Sinha', 'Anupam Sinha']",124,15739
The Passage,producer,Stephen Dorff,Who was the producer of The Passage?,['Stephen Dorff'],317,61177
45 Minutes from Hollywood,producer,Hal Roach,Who was the producer of 45 Minutes from Hollywood?,['Hal Roach'],469,9198
The Secret Game,producer,Jesse Louis Lasky,Who was the producer of The Secret Game?,"['Jesse Louis Lasky', 'Jesse L. Lasky', 'Jesse Lasky', 'Jesse Louis Lasky Sr.']",135,3076
Revelations,producer,Tony Gayton,Who was the producer of Revelations?,['Tony Gayton'],86,374
The Other Side,producer,Sully Erna,Who was the producer of The Other Side?,"['Sully Erna', 'Salvatore Paul Erna Jr.']",455,11715
My Trip Back to the Dark Side,producer,Shane Stanley,Who was the producer of My Trip Back to the Dark Side?,['Shane Stanley'],233,1545
The List,producer,Beth Murphy,Who was the producer of The List?,['Beth Murphy'],169,234
Here,producer,Adrian Belew,Who was the producer of Here?,"['Adrian Belew', 'Robert Steven Belew']",332,22475
September,producer,John Polson,Who was the producer of September?,['John Polson'],480,5370
Western Jamboree,producer,Gene Autry,Who was the producer of Western Jamboree?,"['Smiley Burnette', 'Lester Alvin Burnett', 'Gene Autry', 'Orvon Grover Autry', 'Orvon Gene Autry', 'Jean Rouverol', 'Jean Rouverol Butler']",129,24189
When in Rome,producer,Clarence Brown,Who was the producer of When in Rome?,"['Clarence Brown', 'Clarence Leon Brown']",227,1861
The Spoilers,producer,Bartlett Cormack,Who was the producer of The Spoilers?,"['Edwin Carewe', 'Bartlett Cormack', 'Edward Bartlett Cormack']",308,294
Albert Schweitzer,producer,Jerome Hill,Who was the producer of Albert Schweitzer?,"['Jerome Hill', 'James Jerome Hill', 'Jérôme Hill', 'James Jerome Hill II']",327,479
Home,producer,Carrie Akre,Who was the producer of Home?,['Carrie Akre'],67,644
The Count,producer,Charlie Chaplin,Who was the producer of The Count?,"['Charlie Chaplin', 'Charles Spencer Chaplin', 'Charles Chaplin', 'Sir Charles Spencer Chaplin']",425,273103
The Dove,producer,Norma Talmadge,Who was the producer of The Dove?,"['Norma Talmadge', 'Norma Marie Talmadge']",255,5250
Through the Dark,producer,William Randolph Hearst,Who was the producer of Through the Dark?,"['William Randolph Hearst', 'w.m r. hearst', 'Wiliam R. Hearst', 'william r. hearst', 'w.r. hearst', 'wm r. hearst', 'wm. r. hearst']",102,126493
Interview,producer,Theo van Gogh,Who was the producer of Interview?,['Theo van Gogh'],334,14044
I Am,producer,Todd Zeile,Who was the producer of I Am?,"['Todd Zeile', 'Todd Edward Zeile']",149,2239
The Man Without Desire,producer,Ivor Novello,Who was the producer of The Man Without Desire?,"['Miles Mander', 'Lionel Henry Mander', 'Ivor Novello', 'David Ivor Davies']",304,14150
The Test,producer,Harry S. Webb,Who was the producer of The Test?,['Harry S. Webb'],88,110
W,producer,Mel Ferrer,Who was the producer of W?,"['Mel Ferrer', 'Melchor Gastón Ferrer', 'Melchor Gaston Ferrer']",487,30715
Less Than the Dust,producer,Mary Pickford,Who was the producer of Less Than the Dust?,"['Mary Pickford', 'Gladys Marie Smith', 'Gladys Louise Smith', 'Gladys Mary Moore']",108,38977
Peacetime,producer,Daniel Filho,Who was the producer of Peacetime?,['Daniel Filho'],129,314
Epsilon,producer,Rolf de Heer,Who was the producer of Epsilon?,['Rolf de Heer'],358,1502
It's Not Enough,producer,Pete Townshend,Who was the producer of It's Not Enough?,"['Pete Townshend', 'Peter Dennis Blandford Townshend', '00122214237 IPI', '00054760672 IPI']",126,64396
The Stand Up,producer,David Wexler,Who was the producer of The Stand Up?,['David Wexler'],201,362
Me First,producer,Fernando Ayala,Who was the producer of Me First?,['Fernando Ayala'],78,194
The Woods,producer,Matthew Lessner,Who was the producer of The Woods?,['Matthew Lessner'],124,234
Dog,producer,Suzie Templeton,Who was the producer of Dog?,"['Suzie Templeton', 'Suzanah Clare Templeton']",146,337
Cake: A Wedding Story,producer,Will Wallace,Who was the producer of Cake: A Wedding Story?,['Will Wallace'],270,266
Airport,producer,Anupam Sinha,Who was the producer of Airport?,"['Anubhav Sinha', 'Anupam Sinha']",124,479
Healers of the Dead Sea,producer,John M. Allegro,Who was the producer of Healers of the Dead Sea?,"['John M. Allegro', 'John Marco Allegro']",141,1886
Just Around the Corner,producer,William Randolph Hearst,Who was the producer of Just Around the Corner?,"['Cosmopolitan Productions', 'William Randolph Hearst', 'w.m r. hearst', 'Wiliam R. Hearst', 'william r. hearst', 'w.r. hearst', 'wm r. hearst', 'wm. r. hearst']",128,126493
Shine,producer,Brendan O'Brien,Who was the producer of Shine?,"[""Brendan O'Brien""]",53,3756
The Little Teacher,producer,Mack Sennett,Who was the producer of The Little Teacher?,['Mack Sennett'],133,6667
His Hour,producer,Elinor Glyn,Who was the producer of His Hour?,"['Elinor Glyn', 'Elinor Sutherland']",262,4658
Nuclear Tipping Point,producer,Nuclear Threat Initiative,Who was the producer of Nuclear Tipping Point?,['Nuclear Threat Initiative'],355,2487
Brass,producer,Warner Bros.,Who was the producer of Brass?,"['Warner Bros.', 'Warner Bros. Pictures', 'Warner Bros. Entertainment Inc.', 'Warner Bros. Studios', 'Warner Brothers', 'WB', 'Warner Bros. Entertainment, Inc.']",113,113308
Harvest,producer,Carroll Ballard,Who was the producer of Harvest?,['Carroll Ballard'],120,1282
(One Glance Is) Holy,producer,Mike Oldfield,Who was the producer of (One Glance Is) Holy?,"['Mike Oldfield', 'Michael Gordon Oldfield', 'Michael Oldfield', '00077497524 IPI', '00047039093 IPI']",156,41104
Believe in Me,producer,Irwin Winkler,Who was the producer of Believe in Me?,"['Robert Chartoff', 'Robert Irwin Chartoff', 'Irwin Winkler']",284,10207
Hero,producer,Waheed Murad,Who was the producer of Hero?,['Waheed Murad'],230,5059
Scene,producer,BBC,Who was the producer of Scene?,"['BBC', 'the Beeb', 'British Broadcasting Corporation -- Records and correspondence', 'British Broadcasting Corporation']",214,246420
On Record,producer,Jesse Louis Lasky,Who was the producer of On Record?,"['Jesse Louis Lasky', 'Jesse L. Lasky', 'Jesse Lasky', 'Jesse Louis Lasky Sr.']",111,3076
Colorado,producer,Joseph Kane,Who was the producer of Colorado?,"['Joseph Kane', 'Jasper Joseph Inman Kane']",291,686
The Box,producer,James Russo,Who was the producer of The Box?,"['James Russo', 'James Vincent Russo']",485,13444
Trains of Winnipeg,producer,Clive Holden,Who was the producer of Trains of Winnipeg?,"['Christine Fellows', 'Clive Holden', 'Jason Tait']",61,234
Menu,producer,Pete Smith,Who was the producer of Menu?,"['Pete Smith', 'Peter Schmidt']",154,916
To Love,producer,Faye Wong,Who was the producer of To Love?,['Faye Wong'],316,25191
Hospital Music,producer,Matthew Good,Who was the producer of Hospital Music?,"['Matthew Good', 'Matthew Frederick Robert Good']",301,3308
In the Family,producer,Paulo Porto,Who was the producer of In the Family?,['Paulo Porto'],67,74
Competition,producer,American Film Manufacturing Company,Who was the producer of Competition?,"['American Film Manufacturing Company', 'Flying ""A"" Studios', 'American Film Company']",102,580
Hunting,producer,Frank Howson,Who was the producer of Hunting?,"['Frank Howson', 'Frank Michael Howson']",372,241
April,producer,Nanni Moretti,Who was the producer of April?,"['Nanni Moretti', 'Giovanni ""Nanni"" Moretti', 'Giovanni Moretti']",298,3997
Getting Acquainted,producer,Mack Sennett,Who was the producer of Getting Acquainted?,['Mack Sennett'],280,6667
Big City,producer,Frank Borzage,Who was the producer of Big City?,['Frank Borzage'],267,2460
Three Hours,producer,Corinne Griffith,Who was the producer of Three Hours?,"['Corinne Griffith', 'Corinne Griffith (1894-1979)']",149,1819
Cinema,producer,Tony Visconti,Who was the producer of Cinema?,"['Tony Visconti', 'Anthony Edward Visconti']",139,17525
Partner,producer,Bernardo Bertolucci,Who was the producer of Partner?,['Bernardo Bertolucci'],450,19423
Freddie Foxxx Is Here,producer,Eric B. & Rakim,Who was the producer of Freddie Foxxx Is Here?,"['Eric B. & Rakim', 'Eric B & Rakim', 'Freddie Foxxx', 'James Campbell', 'Bumpy Knuckles']",278,15295
The Easiest Way,producer,Clara Kimball Young,Who was the producer of The Easiest Way?,"['Clara Kimball Young', 'Clara Kimball', 'Edith Matilda Clara Kimball']",78,1392
Final Score,producer,Jira Maligool,Who was the producer of Final Score?,"['Jira Maligool', 'Chira Malikun']",101,541
The Castle,producer,Maximilian Schell,Who was the producer of The Castle?,['Maximilian Schell'],365,24054
Don't Mess with Bill,producer,Pen Densham,Who was the producer of Don't Mess with Bill?,['Pen Densham'],137,889
Heart,producer,Vittorio De Sica,Who was the producer of Heart?,"['Vittorio De Sica', 'Vittorio de Sica']",178,11601
Cops and Robbers,producer,Carlo Ponti,Who was the producer of Cops and Robbers?,"['Dino De Laurentiis', 'Agostino De Laurentiis', 'Carlo Ponti', 'Carlo Ponti, Sr.']",449,19862
The Nut,producer,Douglas Fairbanks,Who was the producer of The Nut?,"['Douglas Fairbanks', 'Douglas Fairbanks, Sr.', 'Douglas Elton Thomas Ullman', 'Douglas Ullman', 'Doug Fairbanks']",264,31619
Vice,producer,Daryl Hannah,Who was the producer of Vice?,"['Daryl Hannah', 'Daryl Christine Hannah', 'dhlovelife']",449,108028
Contract,producer,Yvonne Okoro,Who was the producer of Contract?,"['Yvonne Okoro', 'Chinyere Yvonne Okoro']",158,1369
Kitchen,producer,Andy Warhol,Who was the producer of Kitchen?,"['Andy Warhol', 'Andrew Warhola', 'Andrew Warhol', 'Drella', 'Andrej Varchol', 'Andrej Warhol']",221,218598
Changes,producer,Hall Bartlett,Who was the producer of Changes?,['Hall Bartlett'],289,1621
Toughest Gun in Tombstone,producer,Edward Small,Who was the producer of Toughest Gun in Tombstone?,['Edward Small'],278,902
Genre,producer,Don Hertzfeldt,Who was the producer of Genre?,"['Don Hertzfeldt', 'Donald Hertzfeldt']",106,6981
The Marriage Circle,producer,Ernst Lubitsch,Who was the producer of The Marriage Circle?,['Ernst Lubitsch'],499,7437
It Takes Two,producer,Dean Shek,Who was the producer of It Takes Two?,['Dean Shek'],244,1686
The Distance,producer,Simon Climie,Who was the producer of The Distance?,['Simon Climie'],232,3282
Saanch Ko Aanch Nahin,producer,Tarachand Barjatya,Who was the producer of Saanch Ko Aanch Nahin?,['Tarachand Barjatya'],448,3640
Hired!,producer,Jam Handy,Who was the producer of Hired!?,"['Jam Handy', 'Henry Jamison Handy', 'Jamison Handy']",30,1126
About Time,producer,Daevid Allen,Who was the producer of About Time?,"['Daevid Allen', 'Christopher David Allen']",332,3561
Shine,producer,Luna Sea,Who was the producer of Shine?,"['Luna Sea', 'Lunacy']",56,2942
The Congress,producer,Ken Burns,Who was the producer of The Congress?,"['Ken Burns', 'Kenneth Lauren Burns', 'Kenneth L. Burns', 'Kenneth Burns']",388,49104
De Laatste Dagen van een Eiland,producer,Ernst Winar,Who was the producer of De Laatste Dagen van een Eiland?,['Ernst Winar'],67,118
The Road,director,Darezhan Omirbaev,Who was the director of The Road?,['Darezhan Omirbaev'],107,231
Wedding in White,director,William Fruet,Who was the director of Wedding in White?,['William Fruet'],358,398
The Island of Desire,director,Otis Turner,Who was the director of The Island of Desire?,['Otis Turner'],197,256
Anybody's Woman,director,Dorothy Arzner,Who was the director of Anybody's Woman?,"['Dorothy Arzner', 'Dorothy Emma Arzner']",158,3190
Number Our Days,director,Lynne Littman,Who was the director of Number Our Days?,['Lynne Littman'],272,2013
Only People,director,Branko Bauer,Who was the director of Only People?,['Branko Bauer'],112,294
L'Homme du large,director,Marcel L'Herbier,Who was the director of L'Homme du large?,"[""Marcel L'Herbier"", ""Marcel L' Herbier""]",189,742
By Indian Post,director,John Ford,Who was the director of By Indian Post?,"['John Ford', 'Jack Ford', 'John Martin Feeney']",138,35178
Go Go Amigo,director,Robert McKimson,Who was the director of Go Go Amigo?,"['Robert McKimson', 'Bob McKimson']",235,3225
City of Beautiful Nonsense,director,Adrian Brunel,Who was the director of City of Beautiful Nonsense?,"['Adrian Brunel', 'Adrian Hope Brunel']",87,322
Useless,director,Jia Zhangke,Who was the director of Useless?,['Jia Zhangke'],244,7231
Bhoopathi Ranga,director,Geethapriya,Who was the director of Bhoopathi Ranga?,"['Geethapriya', 'Lakshman Rao Mohite']",164,502
Hunger,director,Peter Foldes,Who was the director of Hunger?,"['Peter Foldes', 'Peter Foldès']",285,255
The Idea,director,Berthold Bartosch,Who was the director of The Idea?,['Berthold Bartosch'],306,286
Iris and the Lieutenant,director,Alf Sjöberg,Who was the director of Iris and the Lieutenant?,['Alf Sjöberg'],149,622
The Mutants,director,Teresa Villaverde,Who was the director of The Mutants?,['Teresa Villaverde'],214,434
Love Letter,director,Kinuyo Tanaka,Who was the director of Love Letter?,['Kinuyo Tanaka'],266,1645
The Sisters,director,Christy Cabanne,Who was the director of The Sisters?,"['Christy Cabanne', 'William Christy Cabanne']",93,891
Washed Out,director,Zrinko Ogresta,Who was the director of Washed Out?,['Zrinko Ogresta'],130,414
A Woman,director,Charlie Chaplin,Who was the director of A Woman?,"['Charlie Chaplin', 'Charles Spencer Chaplin', 'Charles Chaplin', 'Sir Charles Spencer Chaplin']",430,273103
Perfect Understanding,director,Cyril Gardner,Who was the director of Perfect Understanding?,['Cyril Gardner'],300,310
Trail of the Vigilantes,director,Allan Dwan,Who was the director of Trail of the Vigilantes?,['Allan Dwan'],130,1773
Making Angels,director,Charles Beeson,Who was the director of Making Angels?,['Charles Beeson'],356,246
The Clinic,director,David Stevens,Who was the director of The Clinic?,['David Stevens'],233,459
Those Who Love,director,Manning Haynes,Who was the director of Those Who Love?,"['Manning Haynes', 'Horace Manning Haynes']",72,97
What Every Woman Learns,director,Fred Niblo,Who was the director of What Every Woman Learns?,"['Fred Niblo', 'Frederick Liedtke', 'Federico Nobile']",105,938
Stepping Out,director,Charles Reisner,Who was the director of Stepping Out?,['Charles Reisner'],137,544
Chairman George,director,Daniel Cross,Who was the director of Chairman George?,"['Daniel Cross', 'Mila Aung-Thwin']",209,264
Chi,director,Anne Wheeler,Who was the director of Chi?,['Anne Wheeler'],98,813
In Your Hands,director,Peter Del Monte,Who was the director of In Your Hands?,['Peter Del Monte'],127,2217
The Only Thing,director,Jack Conway,Who was the director of The Only Thing?,"['Jack Conway', 'Jack Conway (filmmaker)']",224,1614
Asphalt,director,Kim Ki-young,Who was the director of Asphalt?,"['Kim Ki-young', 'Kim Ki-yeong']",103,2021
Spin the Bottle,director,Joss Whedon,Who was the director of Spin the Bottle?,"['Joss Whedon', 'Joseph Hill Whedon']",428,122100
The White Suit,director,Lazar Ristovski,Who was the director of The White Suit?,['Lazar Ristovski'],164,1730
The Happy Family,director,Maclean Rogers,Who was the director of The Happy Family?,['Maclean Rogers'],59,185
The Challenge,director,Milton Rosmer,Who was the director of The Challenge?,"['Milton Rosmer', 'Luis Trenker', 'Alois Franz Trenker']",264,298
Pilot,director,Francis Lawrence,Who was the director of Pilot?,['Francis Lawrence'],118,19362
Wanted,director,Giorgio Ferroni,Who was the director of Wanted?,['Giorgio Ferroni'],246,329
In the Money,director,William Beaudine,Who was the director of In the Money?,"['William Beaudine', 'William Washington Beaudine']",273,1319
After Hours,director,James Hayman,Who was the director of After Hours?,['James Hayman'],206,12617
The Chief,director,Charles Reisner,Who was the director of The Chief?,['Charles Reisner'],164,544
Kitchen,director,Yim Ho,Who was the director of Kitchen?,['Yim Ho'],198,370
The African Woman,director,Margarethe von Trotta,Who was the director of The African Woman?,"['Margarethe von Trotta', 'Margarethe Von Trotta']",167,2104
I Love You,director,Arnaldo Jabor,Who was the director of I Love You?,['Arnaldo Jabor'],381,383
The Lie,director,Allan Dwan,Who was the director of The Lie?,['Allan Dwan'],124,1773
Foreign Affairs,director,Pete Michels,Who was the director of Foreign Affairs?,['Pete Michels'],130,587
The Secret,director,Robert Enrico,Who was the director of The Secret?,['Robert Enrico'],216,596
The Trust,director,Lon Chaney,Who was the director of The Trust?,"['Lon Chaney', 'Leonidas Frank Chaney', 'Lon Chaney, Sr.', 'The Man of a Thousand Faces']",231,41699
Get Well Soon,director,Jean Becker,Who was the director of Get Well Soon?,['Jean Becker'],197,392
Like You Know It All,director,Hong Sang-soo,Who was the director of Like You Know It All?,"['Hong Sang-soo', 'Hong Sang Soo']",449,11729
The Creator,director,Albert Dupontel,Who was the director of The Creator?,['Albert Dupontel'],304,4135
The Only Woman,director,Sidney Olcott,Who was the director of The Only Woman?,['Sidney Olcott'],96,545
Allow Me,director,Mario Bonnard,Who was the director of Allow Me?,['Mario Bonnard'],146,284
Thicker than Water,director,The Malloys,Who was the director of Thicker than Water?,"['Jack Johnson', 'Jack Hody Johnson', 'The Malloys']",463,819
About Love,director,Zhang Yibai,Who was the director of About Love?,"['Zhang Yibai', 'Zhang Xiaoling']",352,474
The Gamble,director,Tom Ricketts,Who was the director of The Gamble?,['Tom Ricketts'],61,979
The Suspect,director,Ringo Lam,Who was the director of The Suspect?,"['Ringo Lam', 'Ringo Lam Ling-Tung']",240,2664
Sukeban,director,Noribumi Suzuki,Who was the director of Sukeban?,['Noribumi Suzuki'],294,596
Breaking News,director,Nagathihalli Chandrashekhar,Who was the director of Breaking News?,['Nagathihalli Chandrashekhar'],409,1890
The Bells and Whistles,director,Craig Zisk,Who was the director of The Bells and Whistles?,['Craig Zisk'],121,1207
The Final Test,director,Anthony Asquith,Who was the director of The Final Test?,"['Anthony Asquith', 'Hon. Anthony Asquith', 'Anthony William Lowell Asquith']",274,2520
The Medium,director,Gian Carlo Menotti,Who was the director of The Medium?,['Gian Carlo Menotti'],233,12324
Pirates of Malaysia,director,Umberto Lenzi,Who was the director of Pirates of Malaysia?,['Umberto Lenzi'],378,2579
Avatar,director,Carmine Gallone,Who was the director of Avatar?,"['Carmine Gallone', 'Carmelo Gallone']",171,454
Hotel Splendide,director,Michael Powell,Who was the director of Hotel Splendide?,"['Michael Powell', 'Michael Latham Powell', 'Powell']",152,10431
The Dream,director,Pieter Verhoeff,Who was the director of The Dream?,['Pieter Verhoeff'],100,144
The System,director,Lewis Seiler,Who was the director of The System?,['Lewis Seiler'],139,438
The Sale,director,Hossein Shahabi,Who was the director of The Sale?,['Hossein Shahabi'],108,138
The Black Book,director,Spencer Gordon Bennet,Who was the director of The Black Book?,['Spencer Gordon Bennet'],129,525
Into the Deep,director,Ron Underwood,Who was the director of Into the Deep?,"['Ron Underwood', 'Ronald Brian Underwood']",388,4367
Audace colpo dei soliti ignoti,director,Nanni Loy,Who was the director of Audace colpo dei soliti ignoti?,"['Nanni Loy', 'Giovanni Loi']",360,457
Revenge,director,Edwin Carewe,Who was the director of Revenge?,['Edwin Carewe'],135,553
Monte Carlo Madness,director,Hanns Schwarz,Who was the director of Monte Carlo Madness?,['Hanns Schwarz'],237,299
The inn,director,Jerzy Kawalerowicz,Who was the director of The inn?,"['Jerzy Kawalerowicz', 'Jerzy Franciszek Kawalerowicz']",317,989
The Heart,director,Kon Ichikawa,Who was the director of The Heart?,['Kon Ichikawa'],252,2632
No Good Deed,director,Lawrence Trilling,Who was the director of No Good Deed?,['Lawrence Trilling'],107,1820
Still Life,director,Sohrab Shahid-Saless,Who was the director of Still Life?,"['Sohrab Shahid-Saless', 'Sohrab Shaheed Salles', 'Sohrab Shadid Saless']",235,551
San Francisco,director,Anthony Stern,Who was the director of San Francisco?,['Anthony Stern'],266,170
Intruder,director,Vicente Aranda,Who was the director of Intruder?,"['Vicente Aranda', 'Vicente Aranda Ezquerra']",168,632
Homecoming,director,Joe May,Who was the director of Homecoming?,['Joe May'],170,699
Cool It,director,Ondi Timoner,Who was the director of Cool It?,['Ondi Timoner'],433,974
Great Day,director,Lance Comfort,Who was the director of Great Day?,['Lance Comfort'],218,483
Senior Year,director,Jerrold Tarog,Who was the director of Senior Year?,"['Jerrold Tarog', 'Jerrold Viacrucis Tarog']",71,2638
Escape,director,Basil Dean,Who was the director of Escape?,"['Basil Dean', 'Basil Herbert Dean']",198,802
Little Man,director,Nicole Conn,Who was the director of Little Man?,['Nicole Conn'],229,1863
Choices,director,David Lowell Rich,Who was the director of Choices?,['David Lowell Rich'],217,557
Silver,director,Takashi Miike,Who was the director of Silver?,['Takashi Miike'],377,36436
His Way,director,Douglas McGrath,Who was the director of His Way?,"['Douglas McGrath', 'Douglas Geoffrey McGrath']",283,1136
Boy Meets Dog,director,Walter Lantz,Who was the director of Boy Meets Dog?,"['Walter Lantz', 'Walter Benjamin Lantz']",444,6020
The Bench,director,Per Fly,Who was the director of The Bench?,"['Per Fly', 'Per Fly Plejdrup']",293,419
Safety First,director,Fred Paul,Who was the director of Safety First?,['Fred Paul'],284,197
Victoria,director,Anna Karina,Who was the director of Victoria?,"['Anna Karina', 'Hanne Bayer', 'Hanne Karin Bayer', 'Hanne Karen Blarke Bayer', 'Hanne Karin Blarke Bayer']",316,12650
Marina's Destiny,director,Viktor Ivchenko,Who was the director of Marina's Destiny?,"['Viktor Ivchenko', 'Viktor Illarionovich Ivchenko']",128,89
Impulse,director,Cy Endfield,Who was the director of Impulse?,"['Cy Endfield', 'Cyril Raker Endfield']",284,2360
Suddenly,director,Diego Lerman,Who was the director of Suddenly?,['Diego Lerman'],214,111
Winner Takes All,director,Clifton Ko,Who was the director of Winner Takes All?,"['Clifton Ko', 'Gao Zhisen']",324,408
Out of Control,director,Dominic Savage,Who was the director of Out of Control?,['Dominic Savage'],299,1831
Green Tea,director,Zhang Yuan,Who was the director of Green Tea?,"['Zhang Yuan', 'Yuan Zhang']",300,659
Victory,director,Vsevolod Pudovkin,Who was the director of Victory?,"['Mikhail Doller', 'Mikhail Ivanovich Doller', 'Vsevolod Pudovkin', 'Vsevolod Illarionovich Pudovkin', 'Wsewolod Illarionowitsch Pudowkin']",64,1976
Sunset Limousine,director,Terry Hughes,Who was the director of Sunset Limousine?,['Terry Hughes'],209,1110
Me First,director,Fernando Ayala,Who was the director of Me First?,['Fernando Ayala'],78,194
Sunrise,director,Raymond Longford,Who was the director of Sunrise?,"['Raymond Longford', 'John Walter Longford']",204,203
Masks,director,Claude Chabrol,Who was the director of Masks?,"['Claude Chabrol', 'Claude Henri Jean Chabrol']",287,8711
Frozen,director,Derek Kwok,Who was the director of Frozen?,"['Derek Kwok', 'Derek Kwok Chi-Kin', 'Chi-kin Kwok']",335,576
The Trial,director,Georg Wilhelm Pabst,Who was the director of The Trial?,"['Georg Wilhelm Pabst', 'George Willhelm Pabst']",276,2716
Lakshyabhed,director,Raj Mukherji,Who was the director of Lakshyabhed?,['Raj Mukherji'],138,515
H,director,Darrell Wasyk,Who was the director of H?,['Darrell Wasyk'],212,129
Tomorrow,director,Francesca Archibugi,Who was the director of Tomorrow?,['Francesca Archibugi'],194,316
Hum Ek Hain,director,Syed Noor,Who was the director of Hum Ek Hain?,"['Syed Noor', 'Syed Ghulam Mohyuddin Noor']",159,1560
The Fool,director,Christine Edzard,Who was the director of The Fool?,['Christine Edzard'],280,236
The Last Producer,director,Burt Reynolds,Who was the director of The Last Producer?,"['Burt Reynolds', 'Burton Leon Reynolds, Jr.', 'Burton Leon Reynolds', 'Burton Milo Reynolds Jr.']",454,169193
