subj,prop,obj,question,answers_list,s_pop,o_pop
Step Across the Border,composer,Fred Frith,Who was the composer of Step Across the Border?,"['Fred Frith', 'Jeremy Webster ""Fred"" Frith', 'Jeremy Webster Frith']",332,3336
Empty Room,composer,Aleena Gibson,Who was the composer of Empty Room?,"['Aleena Gibson', 'Bobby Ljunggren', 'Robert Vasilis Ljunggren', 'Robert Vasilis Engdahl']",111,246
I Wanna Pick You Up,composer,Brian Wilson,Who was the composer of I Wanna Pick You Up?,"['Brian Wilson', 'Brian Douglas Wilson']",229,100925
Virginia,composer,Saverio Mercadante,Who was the composer of Virginia?,"['Saverio Mercadante', 'Giuseppe Saverio Raffaele Mercadante']",155,1058
Separado!,composer,Gruff Rhys,Who was the composer of Separado!?,"['Gruff Rhys', 'Gruffudd Maredudd Bowen Rhys']",116,6057
Abhinandanam,composer,Kannur Rajan,Who was the composer of Abhinandanam?,['Kannur Rajan'],265,985
Everyone,composer,Van Morrison,Who was the composer of Everyone?,"['Van Morrison', 'George Morrison', 'George Ivan Morrison', 'Sir George Morrison', 'Sir George Ivan Morrison', 'Van the Man']",320,171213
In the Garden,composer,Van Morrison,Who was the composer of In the Garden?,"['Van Morrison', 'George Morrison', 'George Ivan Morrison', 'Sir George Morrison', 'Sir George Ivan Morrison', 'Van the Man']",312,171213
Gaandharvam,composer,Baburaj,Who was the composer of Gaandharvam?,['Baburaj'],116,3987
Time Machine,composer,Michael Daugherty,Who was the composer of Time Machine?,"['Michael Daugherty', 'Michael Kevin Daugherty']",81,1138
Dude,composer,Galt MacDermot,Who was the composer of Dude?,"['Galt MacDermot', 'Arthur Terence Galt MacDermot']",416,3659
Porch,composer,Eddie Vedder,Who was the composer of Porch?,"['Eddie Vedder', 'Eddie Jerome Vedder', 'Edward Louis Severson III']",76,117717
The Idea,composer,Arthur Honegger,Who was the composer of The Idea?,"['Arthur Honegger', 'Oscar-Arthur Honegger']",306,3885
Eliza,composer,Thomas Arne,Who was the composer of Eliza?,"['Thomas Arne', 'Thomas Augustus Arne', 'Thomas Augustine Arne']",112,2303
Shine,composer,Luna Sea,Who was the composer of Shine?,"['Luna Sea', 'Lunacy']",56,2942
Noé,composer,Georges Bizet,Who was the composer of Noé?,"['Georges Bizet', 'Alexandre César Léopold Bizet', 'Alexandre Cesar Leopold Bizet']",303,16191
Nozze istriane,composer,Antonio Smareglia,Who was the composer of Nozze istriane?,['Antonio Smareglia'],96,183
Aa Divasam,composer,Shyam,Who was the composer of Aa Divasam?,['Shyam'],439,2446
New York City,composer,John Lennon,Who was the composer of New York City?,"['John Lennon', 'John Winston Ono Lennon', 'John Winston Lennon', 'Lennon John', 'John Ono Lennon']",420,453988
All Because of You,composer,Butch Walker,Who was the composer of All Because of You?,"['Avril Lavigne', 'Avril Ramona Lavigne', 'Butch Walker']",114,5838
I Will,composer,Dick Glasser,Who was the composer of I Will?,"['Dick Glasser', 'Richard Eugene Glasser']",296,309
Soul Eyes,composer,Mal Waldron,Who was the composer of Soul Eyes?,"['Mal Waldron', 'Malcolm Earl ""Mal"" Waldron', 'Malcolm Earl Waldron']",441,2635
Corrupt,composer,Ice-T,Who was the composer of Corrupt?,"['Ice-T', 'Tracy Lauren Marrow', 'Tracy Marrow', 'Ice T', 'Iceberg', 'Ice Oscillator']",256,124269
Eliza,composer,Luigi Cherubini,Who was the composer of Eliza?,"['Luigi Cherubini', 'Luigi Maria Cherubini', 'Louis-Charles-Zenobi-Salvador-Marie Cherubini', 'Marie Louis Charles Zanobi Salvador Cherubini']",233,2972
A Broadway Musical,composer,Charles Strouse,Who was the composer of A Broadway Musical?,['Charles Strouse'],407,3659
Mass,composer,Igor Stravinsky,Who was the composer of Mass?,"['Igor Stravinsky', 'Igor Fyodorovich Stravinsky', 'Stravinsky', 'Igor Strawinski', 'Igor Strawinsky', 'Igor Stravinskii', 'Igor Feodorovich Stravinsky', 'Jgor Strawinsky', 'Igor Strawinskij', 'Igor Stravinski', 'Igor Fedorovich Stravinsky', 'I. Strawinsky']",386,42745
String Quartet No. 4,composer,Dmitri Shostakovich,Who was the composer of String Quartet No. 4?,"['Dmitri Shostakovich', 'Shostakovich', 'Shosty', 'Dmitrii Dmitrievich Shostakovich', 'Dmitrij Šostakovič', 'Dmitri Dmitrievitch Chostakovitch', 'Dimitri Shostakovich']",285,41296
Excursions,composer,Samuel Barber,Who was the composer of Excursions?,"['Samuel Barber', 'Samuel Osborne Barber II', 'Samuel Osborne Barber']",363,13581
Alice,composer,Bernardo Sassetti,Who was the composer of Alice?,"['Bernardo Sassetti', 'Bernardo da Costa Sassetti Pais']",255,422
The Boy,composer,Lionel Monckton,Who was the composer of The Boy?,"['Lionel Monckton', 'Lionel John Alexander Monckton']",131,385
Broadway,composer,Teddy McRae,Who was the composer of Broadway?,"['Teddy McRae', 'Theodore McRae', 'Mr. Bear', 'Ted McRae']",166,153
Gentleman,composer,Lou Bega,Who was the composer of Gentleman?,"['Lou Bega', 'David Lubega']",137,17152
Overture in G major,composer,Luigi Cherubini,Who was the composer of Overture in G major?,"['Luigi Cherubini', 'Luigi Maria Cherubini', 'Louis-Charles-Zenobi-Salvador-Marie Cherubini', 'Marie Louis Charles Zanobi Salvador Cherubini']",98,2972
A Banda,composer,Chico Buarque,Who was the composer of A Banda?,"['Chico Buarque', 'Francisco Buarque de Hollanda']",326,4960
Tea for One,composer,Jimmy Page,Who was the composer of Tea for One?,"['Jimmy Page', 'James Patrick Page', 'Jim Page']",96,111008
I'm That Chick,composer,Mariah Carey,Who was the composer of I'm That Chick?,"['Mariah Carey', 'MC', 'Mirage', 'Mimi', 'Elusive Chanteuse', 'Songbird Supreme', 'Carey']",378,336247
For You,composer,Joe Burke,Who was the composer of For You?,"['Joe Burke', 'Joseph Aloysius Burke', 'Joseph A. Burke']",224,483
Lover,composer,Richard Rodgers,Who was the composer of Lover?,"['Richard Rodgers', 'Richard Charles Rodgers']",451,19255
One Life,composer,Roman Vlad,Who was the composer of One Life?,['Roman Vlad'],234,275
The Rock,composer,Sergei Rachmaninoff,Who was the composer of The Rock?,"['Sergei Rachmaninoff', 'Sergei Vasilievich Rachmaninoff', 'Rachmaninoff', 'Rach', 'Sergei Vasilyevich Rachmaninoff']",335,45370
Chasing,composer,Gemma Hayes,Who was the composer of Chasing?,['Gemma Hayes'],68,1431
This Is the Sea,composer,Mike Scott,Who was the composer of This Is the Sea?,"['Mike Scott', 'Michael Scott']",374,9795
Minority,composer,Gigi Gryce,Who was the composer of Minority?,"['Gigi Gryce', 'George General Grice Jr.', 'Basheer Qusim']",189,1127
Never Forget,composer,Gary Barlow,Who was the composer of Never Forget?,['Gary Barlow'],469,33143
Trans,composer,Karlheinz Stockhausen,Who was the composer of Trans?,"['Karlheinz Stockhausen', 'Karl-Heinz Stockhausen', 'Karlheinz Stockhausen']",146,21179
Russian Rhapsody,composer,Sergei Rachmaninoff,Who was the composer of Russian Rhapsody?,"['Sergei Rachmaninoff', 'Sergei Vasilievich Rachmaninoff', 'Rachmaninoff', 'Rach', 'Sergei Vasilyevich Rachmaninoff']",169,45370
String Quartet No. 3,composer,Carl Nielsen,Who was the composer of String Quartet No. 3?,"['Carl Nielsen', 'Carl August Nielsen']",76,7711
Sigurd,composer,Ernest Reyer,Who was the composer of Sigurd?,['Ernest Reyer'],324,311
Take a Chance,composer,Nacio Herb Brown,Who was the composer of Take a Chance?,"['Nacio Herb Brown', 'Ignacio ""Nacio"" Herb Brown', 'Ignacio Herb Brown', 'Ignacio Herbert Brown', 'Vincent Youmans', 'Vincent Millie Youmans']",201,1431
Hero,composer,Rick Wakeman,Who was the composer of Hero?,"['Rick Wakeman', 'Richard Christopher Wakeman']",186,32223
Nurse,composer,M. B. Sreenivasan,Who was the composer of Nurse?,"['M. B. Sreenivasan', 'Manamadurai Balakrishnan Sreenivasan']",182,2297
Without You,composer,Lamont Dozier,Who was the composer of Without You?,"['Lamont Dozier', 'Lamont Herbert Dozier']",347,6130
Hin und zurück,composer,Paul Hindemith,Who was the composer of Hin und zurück?,['Paul Hindemith'],270,6705
That's Right,composer,Johnny Cash,Who was the composer of That's Right?,"['Johnny Cash', 'The Man in Black', 'John R. Cash', 'J. R. Cash']",98,284328
Azure,composer,Duke Ellington,Who was the composer of Azure?,"['Duke Ellington', 'Edward Kennedy ""Duke"" Ellington', 'Edward Kennedy Ellington', 'Edward K. Ellington']",212,52717
Symphony No. 33,composer,Michael Haydn,Who was the composer of Symphony No. 33?,"['Michael Haydn', 'Johann Michael Haydn']",59,3635
The Body,composer,Ron Geesin,Who was the composer of The Body?,['Ron Geesin'],391,1542
Bloomfield,composer,Johnny Harris,Who was the composer of Bloomfield?,"['Johnny Harris', 'John Stanley Livingstone Harris']",365,938
One Love,composer,David Guetta,Who was the composer of One Love?,"['David Guetta', 'Pierre David Guetta', 'Jack Back']",468,54212
The Foundation,composer,Joseph Koo,Who was the composer of The Foundation?,"['Joseph Koo', 'Koo Ka Fai', 'Joseph Koo Kar-Fai']",380,1740
Empty Room,composer,Bobby Ljunggren,Who was the composer of Empty Room?,"['Aleena Gibson', 'Bobby Ljunggren', 'Robert Vasilis Ljunggren', 'Robert Vasilis Engdahl']",111,231
Psyché,composer,Jean-Baptiste Lully,Who was the composer of Psyché?,"['Jean-Baptiste Lully', 'Giovanni Battista Lulli', 'Lulli']",397,10629
Paris,composer,Cole Porter,Who was the composer of Paris?,"['Cole Porter', 'Cole Albert Porter']",263,52688
Symphony No. 8,composer,Einojuhani Rautavaara,Who was the composer of Symphony No. 8?,"['Einojuhani Rautavaara', 'Eino Juhani Rautavaara', 'Eino-Juhani Rautavaara']",92,2667
Salvation,composer,Peter Link,Who was the composer of Salvation?,['Peter Link'],268,194
Saturday Night,composer,Teddy Sinclair,Who was the composer of Saturday Night?,"['Jeff Bhasker', 'Billy Kraven', 'U.G.L.Y.', 'Teddy Sinclair', 'Natalia Noemi Cappuccini', 'Natalia Noemi Sinclair', 'Natalia Kills', 'Verbalicious', 'Candy Rapper', 'Natalia Keery-Fisher', 'Natalia Cappuccini', 'Verse', 'Natalia Sinclair']",205,12032
Discipline,composer,Adrian Belew,Who was the composer of Discipline?,"['Adrian Belew', 'Robert Steven Belew']",53,22475
Love Life,composer,Kurt Weill,Who was the composer of Love Life?,"['Kurt Weill', 'Kurt Julian Weill']",357,11638
Survivor,composer,Iain James,Who was the composer of Survivor?,"['Adam Powers', 'Adam Hersland Powers', 'Iain James']",117,1379
"Christen, ätzet diesen Tag, BWV 63",composer,Johann Sebastian Bach,"Who was the composer of Christen, ätzet diesen Tag, BWV 63?","['Johann Sebastian Bach', 'Bach', 'J.S. Bach', 'J. S. Bach', 'J S Bach']",326,120538
La Silvia,composer,Antonio Vivaldi,Who was the composer of La Silvia?,"['Antonio Vivaldi', 'Prete rosso', 'Antonio Vivarudi', 'Antonio Luciano Vivaldi', 'Vivaldi', 'Antonio Lucio Vivaldi', 'A. Vivaldis']",177,57270
Cue Ball Cat,composer,Scott Bradley,Who was the composer of Cue Ball Cat?,"['Scott Bradley', 'Walter Scott Bradley']",70,1920
The Bolt,composer,Dmitri Shostakovich,Who was the composer of The Bolt?,"['Dmitri Shostakovich', 'Shostakovich', 'Shosty', 'Dmitrii Dmitrievich Shostakovich', 'Dmitrij Šostakovič', 'Dmitri Dmitrievitch Chostakovitch', 'Dimitri Shostakovich']",373,41296
That Was Then,composer,David Was,Who was the composer of That Was Then?,"['David Was', 'David Jay Weiss', 'David Weiss']",423,1680
Patience,composer,Willie Reale,Who was the composer of Patience?,['Willie Reale'],265,416
Let Me Know,composer,Towa Tei,Who was the composer of Let Me Know?,['Towa Tei'],100,4689
Ève,composer,Jules Massenet,Who was the composer of Ève?,"['Jules Massenet', 'Jules Massenet']",219,6330
Soldier,composer,Neil Young,Who was the composer of Soldier?,"['Neil Young', 'Neil Percival Young', 'Shakey', 'Godfather of Grunge', 'Neil Percival Kenneth Robert Ragland Young']",170,221154
One More Time,composer,James LaBrie,Who was the composer of One More Time?,"['James LaBrie', 'Kevin James LaBrie', '00219295358 IPI']",75,12739
Dham,composer,Ramana Gogula,Who was the composer of Dham?,['Ramana Gogula'],462,3135
"Erfreute Zeit im neuen Bunde, BWV 83",composer,Johann Sebastian Bach,"Who was the composer of Erfreute Zeit im neuen Bunde, BWV 83?","['Johann Sebastian Bach', 'Bach', 'J.S. Bach', 'J. S. Bach', 'J S Bach']",160,120538
Isabel's a Jezebel,composer,Galt MacDermot,Who was the composer of Isabel's a Jezebel?,"['Galt MacDermot', 'Arthur Terence Galt MacDermot']",126,3659
Music in the Air,composer,Jerome Kern,Who was the composer of Music in the Air?,"['Jerome Kern', 'Jerome David Kern']",484,9471
Bala,composer,Satyajit Ray,Who was the composer of Bala?,"['Satyajit Ray', 'Manik Da']",385,57115
Sea Drift,composer,Frederick Delius,Who was the composer of Sea Drift?,"['Frederick Delius', 'Frederick Theodore Albert Delius', 'Fritz Theodore Albert Delius']",271,5961
Rose,composer,Anoop Seelin,Who was the composer of Rose?,['Anoop Seelin'],468,966
La bella dormente nel bosco,composer,Ottorino Respighi,Who was the composer of La bella dormente nel bosco?,['Ottorino Respighi'],226,5912
You Never Know,composer,Cole Porter,Who was the composer of You Never Know?,"['Cole Porter', 'Cole Albert Porter']",298,52688
Play,composer,Karlheinz Stockhausen,Who was the composer of Play?,"['Karlheinz Stockhausen', 'Karl-Heinz Stockhausen', 'Karlheinz Stockhausen']",113,21179
Die Heimkehr aus der Fremde,composer,Felix Mendelssohn,Who was the composer of Die Heimkehr aus der Fremde?,"['Felix Mendelssohn', 'Felix Mendelssohn-Bartholdy', 'Jakob Ludwig Felix Mendelssohn Bartholdy', 'Mendelssohn', 'Mendelssohn-Bartholdy']",197,32562
Dream On (An Indian Lullaby),composer,Victor Herbert,Who was the composer of Dream On (An Indian Lullaby)?,"['Victor Herbert', 'Victor August Herbert']",152,2653
Arkansas,composer,Wayland Holyfield,Who was the composer of Arkansas?,['Wayland Holyfield'],267,598
I Love You,composer,Trevor Horn,Who was the composer of I Love You?,"['Trevor Horn', 'Trevor Charles Horn']",193,34096
Sandhya,composer,Baburaj,Who was the composer of Sandhya?,['Baburaj'],138,3987
Piano Trio,composer,Claude Debussy,Who was the composer of Piano Trio?,"['Claude Debussy', 'Claud Debussy', 'Debussy', 'Claude Achille Debussy', 'Achille Claude Debussy', 'C. Debussy', 'Claude-Achille Debussy', 'Achille-Claude', 'Achille-Claude Debussy']",390,70258
Big Foot,composer,Charlie Parker,Who was the composer of Big Foot?,"['Charlie Parker', 'Yardbird', 'Bird', 'Charles Parker Jr.', 'Charlie Parker Jr.', 'Charles Christopher Parker, Jr.']",73,65135
Sometime,composer,Rudolf Friml,Who was the composer of Sometime?,"['Rudolf Friml', 'Charles Rudolf Friml']",75,1324
Lear,composer,Aribert Reimann,Who was the composer of Lear?,['Aribert Reimann'],399,651
Allahu Akbar,composer,Baburaj,Who was the composer of Allahu Akbar?,['Baburaj'],266,3987
Eileen,composer,Victor Herbert,Who was the composer of Eileen?,"['Victor Herbert', 'Victor August Herbert']",160,2653
Prelude for Clarinet,composer,Krzysztof Penderecki,Who was the composer of Prelude for Clarinet?,"['Krzysztof Penderecki', 'Krzysztof Eugeniusz Penderecki']",86,7310
Martin's Lie,composer,Gian Carlo Menotti,Who was the composer of Martin's Lie?,['Gian Carlo Menotti'],106,12324
Home,composer,will.i.am,Who was the composer of Home?,"['will.i.am', 'William James Adams Jr.', 'Zuper Blahq', 'illwilly', 'Will 1X', 'William Adams']",197,92815
Dance a Little Closer,composer,Charles Strouse,Who was the composer of Dance a Little Closer?,['Charles Strouse'],401,3659
I Will Be There,composer,Van Morrison,Who was the composer of I Will Be There?,"['Van Morrison', 'George Morrison', 'George Ivan Morrison', 'Sir George Morrison', 'Sir George Ivan Morrison', 'Van the Man']",208,171213
The Moment's Energy,composer,Evan Parker,Who was the composer of The Moment's Energy?,['Evan Parker'],59,1431
"Das neugeborne Kindelein, BWV 122",composer,Johann Sebastian Bach,"Who was the composer of Das neugeborne Kindelein, BWV 122?","['Johann Sebastian Bach', 'Bach', 'J.S. Bach', 'J. S. Bach', 'J S Bach']",153,120538
Going Up,composer,Louis Hirsch,Who was the composer of Going Up?,"['Louis Hirsch', 'Louis Achille Hirsch']",211,241
Memories,composer,Egbert Van Alstyne,Who was the composer of Memories?,"['Egbert Van Alstyne', '00000690035 IPI', '00071737275 IPI', 'Egbert Anson Van Alstyne']",294,406
Imagine This,composer,Shuki Levy,Who was the composer of Imagine This?,"['Shuki Levy', 'Yehoshua Levy', 'Shuki Y. Levy', 'Shuky Levy', 'Shuky']",263,6103
Pole,composer,Karlheinz Stockhausen,Who was the composer of Pole?,"['Karlheinz Stockhausen', 'Karl-Heinz Stockhausen', 'Karlheinz Stockhausen']",94,21179
Symphony No. 3,composer,Krzysztof Penderecki,Who was the composer of Symphony No. 3?,"['Krzysztof Penderecki', 'Krzysztof Eugeniusz Penderecki']",433,7310
Symphony No. 2,composer,Walter Piston,Who was the composer of Symphony No. 2?,"['Walter Piston', 'Walter Hamor Piston', 'Walter Hamor Piston Jr']",115,1342
Now or Never,composer,Billie Holiday,Who was the composer of Now or Never?,"['Billie Holiday', 'Lady Day', 'Eleanora Fagan Gough', 'Eleanora Harris', 'Eleanora Fagan']",124,126854
The Wife,composer,Tom Noonan,Who was the composer of The Wife?,['Tom Noonan'],304,22549
"Gleichwie der Regen und Schnee vom Himmel fällt, BWV 18",composer,Johann Sebastian Bach,"Who was the composer of Gleichwie der Regen und Schnee vom Himmel fällt, BWV 18?","['Johann Sebastian Bach', 'Bach', 'J.S. Bach', 'J. S. Bach', 'J S Bach']",256,120538
Voices,composer,Jimmy Webb,Who was the composer of Voices?,"['Jimmy Webb', 'Jim Webb', 'James Layne Webb', 'Jimmy Layne Webb', 'Jimmy L. Webb']",491,19553
Snow,composer,Sandy Nelson,Who was the composer of Snow?,"['Sandy Nelson', 'Sander L. Nelson', 'Sander Lloyd Nelson']",230,2750
Orlando finto pazzo,composer,Antonio Vivaldi,Who was the composer of Orlando finto pazzo?,"['Antonio Vivaldi', 'Prete rosso', 'Antonio Vivarudi', 'Antonio Luciano Vivaldi', 'Vivaldi', 'Antonio Lucio Vivaldi', 'A. Vivaldis']",249,57270
Sleep,composer,Eric Whitacre,Who was the composer of Sleep?,"['Eric Whitacre', 'Eric Edward Whitacre']",380,5156
Miss You,composer,Charles Tobias,Who was the composer of Miss You?,"['Charles Tobias', 'Harry Tobias']",73,504
That's What Love Is Made Of,composer,Smokey Robinson,Who was the composer of That's What Love Is Made Of?,"['Smokey Robinson', ""William 'Smokey' Robinson, Jr."", 'Wm. Robinson', 'William Robinson, Jr.', 'Bill ""Smokey"" Robinson', 'Bobby Rogers', 'Robert Edward Rogers']",177,60003
Spiral,composer,Karlheinz Stockhausen,Who was the composer of Spiral?,"['Karlheinz Stockhausen', 'Karl-Heinz Stockhausen', 'Karlheinz Stockhausen']",204,21179
James Albert Duffy,religion,Catholic Church,What is the religion of James Albert Duffy?,"['Catholic Church', 'Roman Catholic Church', 'Church', 'Roman Apostolic Catholic Church']",62,195995
Kenneth Steiner,religion,Catholic Church,What is the religion of Kenneth Steiner?,"['Catholic Church', 'Roman Catholic Church', 'Church', 'Roman Apostolic Catholic Church']",109,195995
Kelvin Felix,religion,Catholic Church,What is the religion of Kelvin Felix?,"['Catholic Church', 'Roman Catholic Church', 'Church', 'Roman Apostolic Catholic Church']",227,195995
Thomas Williams,religion,Christadelphians,What is the religion of Thomas Williams?,"['Christadelphians', 'Christadelphianism', 'Christodelphian']",161,10789
William Jerome McCormack,religion,Catholic Church,What is the religion of William Jerome McCormack?,"['Catholic Church', 'Roman Catholic Church', 'Church', 'Roman Apostolic Catholic Church']",146,195995
Francesco Bonifacio,religion,Catholic Church,What is the religion of Francesco Bonifacio?,"['Catholic Church', 'Roman Catholic Church', 'Church', 'Roman Apostolic Catholic Church']",223,195995
Edward Henry Howard,religion,Catholic Church,What is the religion of Edward Henry Howard?,"['Catholic Church', 'Roman Catholic Church', 'Church', 'Roman Apostolic Catholic Church']",274,195995
Qutaylah bint Abd-al-Uzza,religion,Islam,What is the religion of Qutaylah bint Abd-al-Uzza?,"['Islam', 'Islamic religion', 'Mohammedanism', 'Muslim religion', 'al-’islām', 'religion of the Muslims']",373,233485
Pierre-Antoine Paulo,religion,Catholic Church,What is the religion of Pierre-Antoine Paulo?,"['Catholic Church', 'Roman Catholic Church', 'Church', 'Roman Apostolic Catholic Church']",69,195995
Walter Carey,religion,Anglicanism,What is the religion of Walter Carey?,"['Anglicanism', 'Anglicanism, Anglican Church']",126,56744
Alexander,religion,Islam,What is the religion of Alexander?,"['Islam', 'Islamic religion', 'Mohammedanism', 'Muslim religion', 'al-’islām', 'religion of the Muslims']",213,233485
David Mills,religion,atheism,What is the religion of David Mills?,"['atheism', 'unbelief']",202,82132
Joseph-Médard Émard,religion,Catholic Church,What is the religion of Joseph-Médard Émard?,"['Catholic Church', 'Roman Catholic Church', 'Church', 'Roman Apostolic Catholic Church']",74,195995
Clemente Isnard,religion,Catholic Church,What is the religion of Clemente Isnard?,"['Catholic Church', 'Roman Catholic Church', 'Church', 'Roman Apostolic Catholic Church']",47,195995
Paul Grégoire,religion,Catholic Church,What is the religion of Paul Grégoire?,"['Catholic Church', 'Roman Catholic Church', 'Church', 'Roman Apostolic Catholic Church']",203,195995
Frank White,religion,Anglicanism,What is the religion of Frank White?,"['Anglicanism', 'Anglicanism, Anglican Church']",130,56744
Giovanni Diodati,religion,Calvinism,What is the religion of Giovanni Diodati?,"['Calvinism', 'Reformed Christianity', 'Reformed Protestantism', 'Reformed faith', 'Reformed tradition', 'Reformed', 'Calvinist Christianity', 'Reformed church']",390,95648
Franciszek Rogaczewski,religion,Catholic Church,What is the religion of Franciszek Rogaczewski?,"['Catholic Church', 'Roman Catholic Church', 'Church', 'Roman Apostolic Catholic Church']",78,195995
Henry Moule,religion,Anglicanism,What is the religion of Henry Moule?,"['Anglicanism', 'Anglicanism, Anglican Church']",278,56744
state,religion,Catholic Church,What is the religion of state?,"['Catholic Church', 'Roman Catholic Church', 'Church', 'Roman Apostolic Catholic Church']",112,195995
Arturo Tabera Araoz,religion,Catholic Church,What is the religion of Arturo Tabera Araoz?,"['Catholic Church', 'Roman Catholic Church', 'Church', 'Roman Apostolic Catholic Church']",73,195995
Paul Shan Kuo-hsi,religion,Catholic Church,What is the religion of Paul Shan Kuo-hsi?,"['Catholic Church', 'Roman Catholic Church', 'Church', 'Roman Apostolic Catholic Church']",187,195995
Maximilian Kaller,religion,Catholic Church,What is the religion of Maximilian Kaller?,"['Catholic Church', 'Roman Catholic Church', 'Church', 'Roman Apostolic Catholic Church']",205,195995
Alfred Reid,religion,Anglicanism,What is the religion of Alfred Reid?,"['Anglicanism', 'Anglicanism, Anglican Church']",54,56744
Kevin C. Rhoades,religion,Catholic Church,What is the religion of Kevin C. Rhoades?,"['Catholic Church', 'Roman Catholic Church', 'Church', 'Roman Apostolic Catholic Church']",485,195995
Simon Ntamwana,religion,Catholic Church,What is the religion of Simon Ntamwana?,"['Catholic Church', 'Roman Catholic Church', 'Church', 'Roman Apostolic Catholic Church']",82,195995
Kenneth Kennedy,religion,Anglicanism,What is the religion of Kenneth Kennedy?,"['Anglicanism', 'Anglicanism, Anglican Church']",35,56744
Manuel Aurelio Cruz,religion,Catholic Church,What is the religion of Manuel Aurelio Cruz?,"['Catholic Church', 'Roman Catholic Church', 'Church', 'Roman Apostolic Catholic Church']",190,195995
Father Jean Bernard,religion,Catholic Church,What is the religion of Father Jean Bernard?,"['Catholic Church', 'Roman Catholic Church', 'Church', 'Roman Apostolic Catholic Church']",282,195995
Gerald Frederick Kicanas,religion,Catholic Church,What is the religion of Gerald Frederick Kicanas?,"['Catholic Church', 'Roman Catholic Church', 'Church', 'Roman Apostolic Catholic Church']",279,195995
Lenni Brenner,religion,atheism,What is the religion of Lenni Brenner?,"['atheism', 'unbelief']",468,82132
St. John's Church,religion,Lutheranism,What is the religion of St. John's Church?,"['Lutheranism', 'Lutheran Church', 'Lutherans']",245,81663
Robert J. Fox,religion,Catholic Church,What is the religion of Robert J. Fox?,"['Catholic Church', 'Roman Catholic Church', 'Church', 'Roman Apostolic Catholic Church']",398,195995
Guadalupe Missionaries,religion,Catholic Church,What is the religion of Guadalupe Missionaries?,"['Catholic Church', 'Roman Catholic Church', 'Church', 'Roman Apostolic Catholic Church']",87,195995
John Richardson,religion,Anglicanism,What is the religion of John Richardson?,"['Anglicanism', 'Anglicanism, Anglican Church']",84,56744
Neville Figgis,religion,Anglicanism,What is the religion of Neville Figgis?,"['Anglicanism', 'Anglicanism, Anglican Church']",316,56744
Cecil Warren,religion,Anglicanism,What is the religion of Cecil Warren?,"['Anglicanism', 'Anglicanism, Anglican Church']",136,56744
United Theological Seminary of the Twin Cities,religion,United Church of Christ,What is the religion of United Theological Seminary of the Twin Cities?,"['United Church of Christ', 'UCC', 'Lancaster Theological Seminary']",294,16453
Thomas Cooray,religion,Catholic Church,What is the religion of Thomas Cooray?,"['Catholic Church', 'Roman Catholic Church', 'Church', 'Roman Apostolic Catholic Church']",430,195995
Gabriel Sharma,religion,Anglicanism,What is the religion of Gabriel Sharma?,"['Anglicanism', 'Anglicanism, Anglican Church']",49,56744
Juan Soldevilla y Romero,religion,Catholic Church,What is the religion of Juan Soldevilla y Romero?,"['Catholic Church', 'Roman Catholic Church', 'Church', 'Roman Apostolic Catholic Church']",169,195995
Adam Exner,religion,Catholic Church,What is the religion of Adam Exner?,"['Catholic Church', 'Roman Catholic Church', 'Church', 'Roman Apostolic Catholic Church']",201,195995
Carlo Curis,religion,Catholic Church,What is the religion of Carlo Curis?,"['Catholic Church', 'Roman Catholic Church', 'Church', 'Roman Apostolic Catholic Church']",85,195995
