subj,prop,obj,question,answers_list,s_pop,o_pop
Bolo,father,Abatai,Who is the father of Bolo?,"['Abatai', 'Aixinjueluo Abatai', 'Raoyuminjunwang', 'Min']",167,402
Theodelap of Spoleto,father,Faroald I of Spoleto,Who is the father of Theodelap of Spoleto?,['Faroald I of Spoleto'],87,217
Frans Pourbus the Elder,father,Pieter Pourbus,Who is the father of Frans Pourbus the Elder?,"['Pieter Pourbus', 'Pieter Jansz. Pourbus', 'Pierre Pourbus', 'Pieter, the younger (unidentified) Pourbus', 'Pieter Pourbus the Younger (unidentified)', 'Pieter (unidentified) Pourbus', 'Peeter Pourbus', 'pieter pourbus', 'Peter Porbus', 'peter pourbus', 'P. Pourbus', 'P. Porbus', 'pourbus pieter d. j.', 'Pierre Porbus', 'Peter Pourpus', 'Pieter Jansz Pourbus']",453,569
Mohammad Ali Khan,father,Karim Khan,Who is the father of Mohammad Ali Khan?,"['Karim Khan', 'Mohammad Karim Khan Zand']",469,2770
"Richard Somerset, 2nd Baron Raglan",father,"FitzRoy Somerset, 1st Baron Raglan","Who is the father of Richard Somerset, 2nd Baron Raglan?","['FitzRoy Somerset, 1st Baron Raglan', 'FitzRoy Somerset', 'Fitzroy Somerset, Lord Raglan']",487,6189
Gladys Eleanor Guggenheim,father,Daniel Guggenheim,Who is the father of Gladys Eleanor Guggenheim?,['Daniel Guggenheim'],287,2126
"Mary Herbert, Countess of Pembroke",father,"Gilbert Talbot, 7th Earl of Shrewsbury","Who is the father of Mary Herbert, Countess of Pembroke?","['Gilbert Talbot, 7th Earl of Shrewsbury']",221,654
Me Agtsom,father,Tridu Songtsen,Who is the father of Me Agtsom?,"['Tridu Songtsen', 'Düsong Mangpojé']",178,332
Ariarathes VI of Cappadocia,father,Ariarathes V of Cappadocia,Who is the father of Ariarathes VI of Cappadocia?,['Ariarathes V of Cappadocia'],350,389
Zhuozi,father,Duke Xian of Jin,Who is the father of Zhuozi?,['Duke Xian of Jin'],169,480
Donor,father,Challedon,Who is the father of Donor?,['Challedon'],44,165
Eudamidas III,father,Agis IV,Who is the father of Eudamidas III?,['Agis IV'],184,1486
Skyline,father,Star Kingdom,Who is the father of Skyline?,['Star Kingdom'],58,289
Prized,father,Kris S.,Who is the father of Prized?,['Kris S.'],109,248
"Emma Portman, Viscountess Portman",father,"Henry Lascelles, 2nd Earl of Harewood","Who is the father of Emma Portman, Viscountess Portman?","['Henry Lascelles, 2nd Earl of Harewood']",288,991
Vimolnaka Nabisi,father,Chulalongkorn,Who is the father of Vimolnaka Nabisi?,"['Chulalongkorn', 'Rama V']",189,19964
Æthelburh of Wilton,father,Ealhmund of Kent,Who is the father of Æthelburh of Wilton?,['Ealhmund of Kent'],326,3976
Balendukht,father,Hormizd III,Who is the father of Balendukht?,['Hormizd III'],175,752
Regal Embrace,father,Vice Regent,Who is the father of Regal Embrace?,['Vice Regent'],84,264
Mei Baojiu,father,Mei Lanfang,Who is the father of Mei Baojiu?,['Mei Lanfang'],294,2533
Bert Bertrand,father,Yvan Delporte,Who is the father of Bert Bertrand?,['Yvan Delporte'],48,302
Julia Strachey,father,Oliver Strachey,Who is the father of Julia Strachey?,['Oliver Strachey'],286,466
Mstislav Rostislavich,father,Rostislav I of Kiev,Who is the father of Mstislav Rostislavich?,['Rostislav I of Kiev'],260,682
Colcu mac Domnaill,father,Domnall Ilchelgach,Who is the father of Colcu mac Domnaill?,"['Domnall Ilchelgach', 'Domnall mac Muirchertaig', 'Domnall mac Maic Ercae', ""Domnall 'Ilchegach', High King of Ireland""]",41,169
Folke Zettervall,father,Helgo Zettervall,Who is the father of Folke Zettervall?,"['Helgo Zettervall', 'Helgo Nikolaus Zettervall']",104,222
Isaac B. Desha,father,Joseph Desha,Who is the father of Isaac B. Desha?,['Joseph Desha'],98,688
Yang Wo,father,Yang Xingmi,Who is the father of Yang Wo?,['Yang Xingmi'],256,353
Ki,father,Temmu,Who is the father of Ki?,"['Temmu', 'Emperor Temmu', 'Tenmu-tennō', 'Tenmu', 'Emperor Tenmu']",135,5287
Michael II Apafi,father,Michael I Apafi,Who is the father of Michael II Apafi?,['Michael I Apafi'],227,728
George,father,David VII of Georgia,Who is the father of George?,['David VII of Georgia'],68,1337
Andreyas,father,Yeshaq I,Who is the father of Andreyas?,"['Yeshaq I', 'Gebre Masqal II']",340,709
Arcathius,father,Mithridates VI of Pontus,Who is the father of Arcathius?,"['Mithridates VI of Pontus', 'Mithridates', 'Mithradates VI Eupator', 'Mithradatēs ho Megas', 'Mithridates Philopator Philadelphus', 'Mithridates the Great', 'Mithradates VI Eupator Dionysus', 'Mithradates']",101,13152
Cornelis de Heem,father,Jan Davidsz. de Heem,Who is the father of Cornelis de Heem?,"['Jan Davidsz. de Heem', 'Jan Davidsz de Heem', 'Jan Davidszoon De Heem', 'Jan de Heem', 'Jan David de Heem', 'John David de Haem', 'Monsù Gem Fiammengo', 'Jan Davidsz. De Hume', 'Jan Davidsz. De Heen', 'He Heem', 'Jan D. Heem', 'Jan Davidsz. Ditteems', 'Jan van Heem', 'Jan Davidts de Heem', 'Jan Davidsz. De Hum', 'Jan Davidsz. Deheem', 'Jan Davidsz. De Heeme', 'Jan Davidsz. de, I Heem', 'Jan Davidsz. vander Eem', ""Jan Davidsz. D'Heem de Oude"", 'Jan Davidsz. Deheim', 'Jan Davidsz. Deheme', 'D. Heem', 'Jan Davidsz. De Hemee', 'Jan Davidsz. De Heem', 'Jan Davidsz. van Heem', 'Jan Davidsz. de Hemm', 'Jan De Heem', 'Jan Davidsz. de Heem de Oude', 'Jan Davidsz. Deehem', 'I. D. De Heem', 'Jan Davidsz. De Heme', 'Johan de Heem', 'John David de Haeem', 'John David de Heem', 'Jan Davidsz. De Hem', 'Jan Davidsz. Du Hem', 'Jan Davidsz. Dahem', 'Jan Davidsz.de Heem', 'Jan Davidszoon de Heem', 'Johannes de Heem', 'Jan Davidtsz. van Antwerpen', 'Johannes van Antwerpen', 'I. de Heem', 'Monsu Gem Fiammengo', 'Jan Davisz de Heem', 'Jean David Dehem', 'Jan David De Heem', 'Jan Davids de Heem', 'J. David Deheem', 'Jan de Hoem', 'heem jan davidz de', 'de heem jan davidcz', 'le grand-père de David Dekene', 'Jean David De Heem', 'Jean Deheem', 'J. Heen', 'de Hern', 'Johann Heem', 'Jan Dav. De Heem', ""J. D'Heem"", 'Old Deheem', 'Jan Davidsen de Heem', 'J.D. de Heem. fecit.', 'J. Dehem', 'J. David De Heem', 'Deheeme', 'de heem j.d.', 'J. D. Dehem', 'Johan. de Heem', 'jan davisz de hern', 'Jean-David de Hem', 'J. Davidz de Heem', 'J.D. de Hemm', 'J. D. de Heem. fecit', ""de oude D'Heem"", 'jan davidsz de heem', 'jan davidz de heem', 'david de heem', 'J. D. Deheem', 'Jean Dehem', ""d'oude de Heem"", 'Johann David von Heem', 'J.-D de Heem', 'old Deheeme', 'de oude de Heem', 'John de Heem', 'J. D. Deehem', 'J. De Heem', 'Joh. Dav. de Heem', 'D. Heym', 'de Heame', 'J. D. D. Oude de Heem', 'J.D. Heem', 'Jean de Hem', 'Jan Davidz de Heem', 'Jean-David De Heem', 'Joh. de Heem', 'J. de Herm', 'Monsu` Gem Fiammengo', 'jan davidsz heem', 'Jan Davidse de Heem', 'Joh. Dehéem', 'Joh. Deheém', ""J. D. D'Heem"", ""J. D'Hem"", 'J.-B. Dehem', 'J.D. De Heem', 'Jean David Deheem', 'jan david de heem', 'David de Heym', 'T. D. Deheem', 'J.D. Dehem', 'Jean Dav. de Heem', 'J. Deheem', 'Davidsz de Heem', 'Joh. David de Heem', 'J.D. de Heem. fecit', 'Johann David de Heem', 'Joh. David de Héem', 'Jean-David Deheem', 'J.D. Deheem', 'J. D. de Heem', 'I.D. Deheem', 'Jean David de Heem', 'Jean de Heem', 'I.D. De Heem', 'Jan Davidze de Heem', 'B. Heem', 'Jean David de Hem', 'Jan Davidsz van Heem']",233,1332
Levan Gruzinsky,father,Prince Bakar of Kartli,Who is the father of Levan Gruzinsky?,"['Prince Bakar of Kartli', 'Bakar of Georgia']",72,128
Came Home,father,Gone West,Who is the father of Came Home?,['Gone West'],164,344
Princess Tōchi,father,Temmu,Who is the father of Princess Tōchi?,"['Temmu', 'Emperor Temmu', 'Tenmu-tennō', 'Tenmu', 'Emperor Tenmu']",330,5287
Clem Michael,father,Stephen Michael,Who is the father of Clem Michael?,"['Stephen Michael', 'Stephen Albert Michael']",145,530
Jean-Auguste Barre,father,Jacques-Jean Barre,Who is the father of Jean-Auguste Barre?,"['Jacques-Jean Barre', 'Jean Jacques Barre', 'Jean-Jacques Barré', 'Jean-Jacques Barre']",194,172
Konstanty Władysław Filip Sobieski,father,John III Sobieski,Who is the father of Konstanty Władysław Filip Sobieski?,"['John III Sobieski', 'Jan III Sobieski', 'King of Poland John Sobieski', 'King of Poland John III Sobieski', 'King of Poland Jan III', 'roi de Pologne Jean III', 'III Sobjeskis, Pokaralis Jans', 'King of Poland John III', 'King of Poland Jana III', 'Sobieski, re di Polonia Jan III', 'król Polski Jan III Sobieski', 'III Sobjeskis, Polijas karalis Jans']",312,14935
Eric Anundsson,father,Anund Uppsale,Who is the father of Eric Anundsson?,['Anund Uppsale'],420,445
Maurice Laing,father,John Laing,Who is the father of Maurice Laing?,"['John Laing', 'Sir John William Laing']",138,362
Ginger Punch,father,Awesome Again,Who is the father of Ginger Punch?,['Awesome Again'],129,610
Dance in the Dark,father,Sunday Silence,Who is the father of Dance in the Dark?,['Sunday Silence'],155,3123
Princess Cristina of Bourbon-Two Sicilies,father,Francis II of the Two Sicilies,Who is the father of Princess Cristina of Bourbon-Two Sicilies?,"['Francis II of the Two Sicilies', 'Francis II']",179,5840
Pierre Joxe,father,Louis Joxe,Who is the father of Pierre Joxe?,['Louis Joxe'],339,313
Irene Laskarina,father,Theodore I Laskaris,Who is the father of Irene Laskarina?,['Theodore I Laskaris'],359,4458
Infanta Francisca Josefa of Portugal,father,Peter II of Portugal,Who is the father of Infanta Francisca Josefa of Portugal?,"['Peter II of Portugal', 'Prince, son of João IV, King of Portugal Pedro I', 'king of Portugal Peter II', 'King of Portugal Pedro II', 'roi de Portugal Pierre II', 'Peter II', 'Unico Pedro', 'King of Portugal Petrus II', 'King of Portugal Peter II']",454,4120
Seol Chong,father,Wonhyo,Who is the father of Seol Chong?,"['Wonhyo', 'Won-ho']",307,1091
Frederick Jagiellon,father,Casimir IV Jagiellon,Who is the father of Frederick Jagiellon?,['Casimir IV Jagiellon'],241,5549
But Why Not,father,Blue Larkspur,Who is the father of But Why Not?,['Blue Larkspur'],96,204
Match II,father,Tantieme,Who is the father of Match II?,['Tantieme'],58,165
Concern,father,Broad Brush,Who is the father of Concern?,['Broad Brush'],163,186
Alexander,father,Ivan Shishman of Bulgaria,Who is the father of Alexander?,['Ivan Shishman of Bulgaria'],213,1116
Amenemopet,father,Amenhotep II,Who is the father of Amenemopet?,"['Amenhotep II', 'Amenophis II']",202,8559
"Sophia Jagiellon, Duchess of Brunswick-Lüneburg",father,Sigismund I the Old,"Who is the father of Sophia Jagiellon, Duchess of Brunswick-Lüneburg?","['Sigismund I the Old', 'Sigismund the Old', 'roi de Pologne Sigismond I', 'King of Poland Zygmunt Stary', 'King of Poland Sigismund I', 'Zygmunt Stary', 'King of Poland Zsigmond', 're di Polonia Zygmunt I Stary', 'król Polski Zygmunt I Stary', 'Zygmunt I Stary', 'krol Polski Zygmunt I Stary']",291,5517
Reset,father,Zabeel,Who is the father of Reset?,['Zabeel'],233,1054
Alexandra Kitchin,father,George Kitchin,Who is the father of Alexandra Kitchin?,"['George Kitchin', 'George William Kitchin']",427,195
Nicholas I of Bohemia,father,Ottokar II of Bohemia,Who is the father of Nicholas I of Bohemia?,"['Ottokar II of Bohemia', 'Ottokar II the Great', 'Otakar II the Great']",215,5213
Court Martial,father,Fair Trial,Who is the father of Court Martial?,['Fair Trial'],130,117
Princess Yamanobe,father,Tenji,Who is the father of Princess Yamanobe?,"['Tenji', 'Tenji-tennō', 'Emperor Tenji']",143,3580
Isaac Bowman,father,George Bowman,Who is the father of Isaac Bowman?,['George Bowman'],206,196
Vira Someshwara,father,Vira Narasimha II,Who is the father of Vira Someshwara?,['Vira Narasimha II'],425,323
Caveat,father,Cannonade,Who is the father of Caveat?,['Cannonade'],152,424
Anton II of Georgia,father,Heraclius II of Georgia,Who is the father of Anton II of Georgia?,"['Heraclius II of Georgia', 'Heraclius II', 'Erekle II']",236,2806
Alfred Jefferis Turner,father,Frederick Storrs Turner,Who is the father of Alfred Jefferis Turner?,['Frederick Storrs Turner'],143,31
Matthew Henry Richey,father,Matthew Richey,Who is the father of Matthew Henry Richey?,['Matthew Richey'],90,52
Gouverneur Morris II,father,Gouverneur Morris I,Who is the father of Gouverneur Morris II?,"['Gouverneur Morris I', 'Gouverneur Morris', 'Governor Morris']",464,9074
Alexander,father,Perseus of Macedon,Who is the father of Alexander?,"['Perseus of Macedon', 'Persius']",416,3503
Jinsa,father,Geungusu,Who is the father of Jinsa?,"['Geungusu', 'Geungusu of Baekje']",165,320
Wang Yuankui,father,Wang Tingcou,Who is the father of Wang Yuankui?,['Wang Tingcou'],68,84
Dafydd ap Dafydd ap Llywelyn,father,Dafydd ap Llywelyn,Who is the father of Dafydd ap Dafydd ap Llywelyn?,"['Dafydd ap Llywelyn', 'Daffyd ap Llywelyn, Prince of North Wales']",244,3455
Mojmir II,father,Svatopluk I,Who is the father of Mojmir II?,['Svatopluk I'],393,1672
Dixie Union,father,Dixieland Band,Who is the father of Dixie Union?,['Dixieland Band'],113,187
Niketa Thopia,father,Karl Topia,Who is the father of Niketa Thopia?,['Karl Topia'],315,1197
Telerig of Bulgaria,father,Telets of Bulgaria,Who is the father of Telerig of Bulgaria?,['Telets of Bulgaria'],317,553
Ludmila Zeman,father,Karel Zeman,Who is the father of Ludmila Zeman?,"['Karel Zeman', 'Земан Карел', 'Karla Zemana', 'Карел Земан']",241,1515
Charles Catton the younger,father,Charles Catton,Who is the father of Charles Catton the younger?,"['Charles Catton', 'Charles, the elder Catton', 'R. A. Catton', 'Charles Catton the Elder', 'Charles I Catton', 'Charles, I Catton', 'Charles Caton', 'Charles (I) Catton', 'Caton', 'Catton R.A.', 'Catton', 'R.A. Catton', '[Charles Catton]', 'Charles Catton the elder, RA']",450,208
Mohammed Omar Abdel-Rahman,father,Omar Abdel-Rahman,Who is the father of Mohammed Omar Abdel-Rahman?,['Omar Abdel-Rahman'],335,7322
Herbert Richmond,father,William Blake Richmond,Who is the father of Herbert Richmond?,"['William Blake Richmond', 'Sir William Blake Richmond', 'Sir William Blake Richmond KCB', 'Sir William Blake Richmond KCB, RA', 'William Blake Richmond (Sir)', 'William Blake, Sir Richmond', 'Sir William Richmond', 'William Richmond']",307,676
"Gaston II, Count of Foix",father,"Gaston I, Count of Foix","Who is the father of Gaston II, Count of Foix?","['Gaston I, Count of Foix']",231,287
Dawit III,father,Iyasu I,Who is the father of Dawit III?,"['Iyasu I', 'Iyasu the Great', 'Adyam Sagad']",424,893
"Edward Lloyd-Mostyn, 2nd Baron Mostyn",father,"Edward Lloyd, 1st Baron Mostyn","Who is the father of Edward Lloyd-Mostyn, 2nd Baron Mostyn?","['Edward Lloyd, 1st Baron Mostyn']",131,146
George,father,Constantine I of Georgia,Who is the father of George?,"['Constantine I of Georgia', 'Constantine I Bagrationi, King of Georgia']",58,619
Eormenred of Kent,father,Eadbald of Kent,Who is the father of Eormenred of Kent?,['Eadbald of Kent'],310,1244
George F. Sternberg,father,Charles Hazelius Sternberg,Who is the father of George F. Sternberg?,"['Charles Hazelius Sternberg', 'Sternberg']",213,475
Proud Clarion,father,Hail To Reason,Who is the father of Proud Clarion?,['Hail To Reason'],159,608
Elma Yerburgh,father,Daniel Thwaites,Who is the father of Elma Yerburgh?,['Daniel Thwaites'],386,276
Marvell Thomas,father,Rufus Thomas,Who is the father of Marvell Thomas?,['Rufus Thomas'],332,4191
Manila,father,Lyphard,Who is the father of Manila?,['Lyphard'],389,552
Ragnall mac Gofraid,father,Gofraid mac Arailt,Who is the father of Ragnall mac Gofraid?,['Gofraid mac Arailt'],167,278
Morgan,father,Henry II of England,Who is the father of Morgan?,"['Henry II of England', 'Henry Curtmantle', 'Henry FitzEmpress', 'Henry Plantagenet', 'Henry II', 'King of England Henry II', 'Henry of Anjou', 'King Henry II of England', 'King Henry II']",115,114244
John Shaw-Lefevre,father,Charles Shaw-Lefevre,Who is the father of John Shaw-Lefevre?,"['Charles Shaw-Lefevre', 'Charles Shaw Lefevre']",103,45
Ghazan Marri,father,Khair Bakhsh Marri,Who is the father of Ghazan Marri?,"['Khair Bakhsh Marri', 'Nawab Khair Bakhsh Marri']",378,2137
Now What,father,Chance Play,Who is the father of Now What?,['Chance Play'],59,122
"Thomas Fane, 8th Earl of Westmorland",father,Henry Fane of Brympton,"Who is the father of Thomas Fane, 8th Earl of Westmorland?","['Henry Fane of Brympton', 'Henry Fane of Bristol', 'Henry Fane']",487,136
Arabia,father,Justin II,Who is the father of Arabia?,"['Justin II', 'Iustinus II']",436,7859
Parakramabahu VII of Kotte,father,Bhuvanekabahu VI of Kotte,Who is the father of Parakramabahu VII of Kotte?,"['Bhuvanekabahu VI of Kotte', 'Bhuvaneka Bãhu VI', 'Sapumal Kumaraya', 'Chempaha Perumal']",248,539
Matthew Robinson Boulton,father,Matthew Boulton,Who is the father of Matthew Robinson Boulton?,['Matthew Boulton'],234,3954
"William de Mandeville, 3rd Earl of Essex",father,"Geoffrey de Mandeville, 1st Earl of Essex","Who is the father of William de Mandeville, 3rd Earl of Essex?","['Geoffrey de Mandeville, 1st Earl of Essex']",475,689
Clemente Palma,father,Ricardo Palma,Who is the father of Clemente Palma?,"['Ricardo Palma', 'Manuel Ricardo Palma Soriano']",181,798
Giacomo Guardi,father,Francesco Guardi,Who is the father of Giacomo Guardi?,"['Francesco Guardi', 'Francesco Guada', 'François Guardi', 'Fr. Guardi', 'Francesco Gardis', 'Franchesko Gvardi', 'Francesco Guarde', 'Francesco Gauda', 'Francesco Guardet', 'Francesco Gardi', 'Francesco Garde', 'Francesco de Guardi', 'Francesco Lazzaro Guardi', 'School of Guardi', ""Francesco de' Guardi"", 'Guardie', 'Gaurdy', 'Guada', 'francesco quardi', 'guarde f.', 'Gardi', 'Garde', 'Guardet', 'Gauda', 'guardi francesco', 'franc. guardi', 'Francisco Guardi', 'Fran. Guardi', 'fr. guardi', 'Guarde', 'Guardo', 'Guardi', 'élève de Canaletti Francisco Wardi', 'f. guardi', 'Gaurdi', 'guardi f.', 'Giradi', 'Gardis', 'Franc. Guardi', 'Fr: Guardi', 'Gouardi', 'francesco de guardi', 'franzesco guardi']",99,1741
Zhao Dezhao,father,Emperor Taizu of Song,Who is the father of Zhao Dezhao?,"['Emperor Taizu of Song', 'Tai Zu', 'Zhao Kuangyin']",349,5965
Arch,father,Kris S.,Who is the father of Arch?,['Kris S.'],201,248
Robin Perutz,father,Max Perutz,Who is the father of Robin Perutz?,"['Max Perutz', 'Max Ferdinand Perutz']",185,2410
Therese Huber,father,Christian Gottlob Heyne,Who is the father of Therese Huber?,['Christian Gottlob Heyne'],248,417
"Sir Capel Molyneux, 3rd Baronet",father,"Sir Thomas Molyneux, 1st Baronet","Who is the father of Sir Capel Molyneux, 3rd Baronet?","['Sir Thomas Molyneux, 1st Baronet', 'Lieutenant General Sir Thomas Molyneux, 1st Baronet', 'Thomas Molyneux', 'Sir Thomas Molyneux, 1st Bt.']",74,277
Macrianus Minor,father,Macrianus Major,Who is the father of Macrianus Minor?,"['Macrianus Major', 'Titus Fulvius Macrianus']",238,389
Aydın Menderes,father,Adnan Menderes,Who is the father of Aydın Menderes?,['Adnan Menderes'],263,6956
Mihailo II of Duklja,father,Constantine Bodin,Who is the father of Mihailo II of Duklja?,['Constantine Bodin'],201,1366
"Anselm Marshal, 6th Earl of Pembroke",father,"William Marshal, 1st Earl of Pembroke","Who is the father of Anselm Marshal, 6th Earl of Pembroke?","['William Marshal, 1st Earl of Pembroke', 'William the Marshal', 'Williame le Mareschal', 'William Marshal']",119,18545
Demetrios Palaiologos,father,Andronikos II Palaiologos,Who is the father of Demetrios Palaiologos?,"['Andronikos II Palaiologos', 'Andronicus II Palaeologus', 'Andronicus II']",227,5738
John,father,Rupert,Who is the father of John?,"['Rupert', 'Ruprecht']",491,1282
Murong Wei,father,Murong Jun,Who is the father of Murong Wei?,"['Murong Jun', 'Emperor Jingzhao of Yan', 'Xuanying', 'Lie Zu', 'Jingzhao Di']",261,308
Leif Claesson,father,Stig Claesson,Who is the father of Leif Claesson?,"['Stig Claesson', 'John Stig Claesson']",57,190
Georg Adolf Erman,father,Paul Erman,Who is the father of Georg Adolf Erman?,['Paul Erman'],94,171
George,father,Andrew I of Hungary,Who is the father of George?,"['Andrew I of Hungary', 'Andrew I']",310,2283
Louis,father,"Rorgon I, Count of Maine",Who is the father of Louis?,"['Rorgon I, Count of Maine']",72,519
John Donkin,father,Bryan Donkin,Who is the father of John Donkin?,['Bryan Donkin'],40,649
One Count,father,Count Fleet,Who is the father of One Count?,['Count Fleet'],127,612
Ours,father,Alain Souchon,Who is the father of Ours?,"['Alain Souchon', 'Alain Kienast', 'Alain Edouard Kienast']",180,1478
Searching,father,War Admiral,Who is the father of Searching?,['War Admiral'],95,4161
Bahman Mirza Qajar,father,Abbas Mirza,Who is the father of Bahman Mirza Qajar?,"['Abbas Mirza', 'Abas-Mirza']",445,2434
Alexander,father,Lysimachus,Who is the father of Alexander?,['Lysimachus'],223,5590
Pieter Gerardus van Os,father,Jan van Os,Who is the father of Pieter Gerardus van Os?,"['Jan van Os', 'Jan V. Os', 'Wanoos', 'Jan Van Os', 'Jan van Ost', 'Jan van Oss', 'Jan Os', 'Van-Os', 'Van Os', 'van os j.', 'Vannox', 'I. van Os', 'Jan van Oos', 'Jean Van Os', 'Jean van Ors', 'Van Ost', 'g. j. van os', 'Van Oss', 'J: van Os', 'Van. Os', 'Vannox Fiammingo', 'Vanos', 'Os', 'V. Os', 'J. Van Oss', 'jan van os', 'J. V. Os', 'Van Oos', 'J. Os', 'J.V. Os', 'J. Van Os', 'V. Oss', 'V. Ost']",111,173
"Hedwig of France, Countess of Nevers",father,Robert II of France,"Who is the father of Hedwig of France, Countess of Nevers?","['Robert II of France', 'Robert II']",365,11727
"Henry Fairfield Osborn, Jr.",father,Henry Fairfield Osborn,"Who is the father of Henry Fairfield Osborn, Jr.?","['Henry Fairfield Osborn', 'Henry Fairfield Osborn, Sr.', 'Osborn', 'H. F. Osborn']",198,2439
Coastal,father,Majestic Prince,Who is the father of Coastal?,['Majestic Prince'],287,621
Yoko Yazawa,father,Eikichi Yazawa,Who is the father of Yoko Yazawa?,['Eikichi Yazawa'],254,1320
Armed,father,Bull Lea,Who is the father of Armed?,['Bull Lea'],235,276
Malcolm Munthe,father,Axel Munthe,Who is the father of Malcolm Munthe?,['Axel Munthe'],442,2663
Smile,father,In Reality,Who is the father of Smile?,['In Reality'],106,310
Cornelis Bloemaert,father,Abraham Bloemaert,Who is the father of Cornelis Bloemaert?,"['Abraham Bloemaert', 'Abraham Bloemaart', 'Abraham Blumard', 'Abraham Blomert', 'Abraham Bloemmert', 'Abraham Blomart', 'Abraham Van Bloemart', 'Abraham Blommert den Ouden', 'Abraham Blomaert', 'Abraham Bloemart', 'Abraham Blommaert den Ouden', 'Ab. Blomart', 'Abraham Blommert', 'Abrm Bloemart', 'A. Blomart', 'Abraham Bloemar', 'Abraham Bloemert', 'A. Blomard', 'Abraham Bloamert', 'Blomaert', 'Blomarte', 'A Bloemart', 'Bloemart. A.', 'Blommaert', 'Abrahame Bloemart', 'A. Bloemaert', 'A. Bloemaers', 'A. Bloemært', 'Blomcart', 'Blomardt', 'A. Bloemmart', 'Bloemant', 'Abraham Bloemaere', 'Blommouth', 'arblomar', 'A. Blomert', 'Abr. Bloemhart', 'Bloëmaert', 'Blommer', 'Abr. Blomart', 'Abr. Bloemart', 'Bloemaers', 'Bloemmert', 'Bloemaert', 'Abr. Blomard', 'abraham van bloemaert', 'Bloemars', 'Abraham Blomhardt', 'Braham Bloemaert', 'A. Blommert', 'A. Bloomart', 'Bloëmart', 'Bloomart', 'Abrah. Blomard', 'a. blomaert', 'abraham blomaert', 'Abraham Blummard', 'Blovemart', 'bloemaert abraham', 'A. Bloemmaert', 'A. Bloemaard', 'den ouden Blommert', 'Abraham Blomaer', 'A. Bloemaart', 'Abrah. Bloemaert', 'de Blomaert', 'Bloemmaert', 'Abraham Blommaerts', 'Ab. Blomaert', 'Abrah. Blomaert', 'Bloemart', 'A. Blomhaert', 'A. Blommaer', 'blommart', 'Abraham Blommart', 'Abramo Bloemart', 'A. Blomaert', 'Bloemaërt', 'Abm. Bloemart', 'Abrah. Bloemert', 'Bolemaert', 'abraham bloemart', 'Blomeart', 'Adam Bloémaert', 'Abraham Bloemarth', 'Abraham von Bloemaet', 'Bloemaart', 'Bloémard', 'Blomant', 'A. Blommaert', 'a. bloemart', 'Abrah. Blömart', 'Abraham van Bloemaert', 'Arraham Bloemaert', 'Ab. Bloemaert', 'Abr. Bloemaert', 'abr. bloemaert', 'Ab. Bloemart', 'Abraham Blommaert', 'Blomert', 'Blomaerts', 'A. Bloemar', 'A. Bloemarh', 'den ouden Blommaert', 'Blommert', 'Bloomant', 'Abr. Blomardt', 'A. Bloomaert', 'Blomart', 'A. Bloemart', 'Abrah. Bloemaart', 'Abraham Bommaert', 'Abr. Blomaert', 'A. Bloemäart', 'Bloemarert', 'Bloumart', 'Blumard', 'Abraham Blomeart', 'Abraham Bloemaat', 'an blomar', 'Bloemar', 'A. Bloemert', 'Van Bloemart', 'Blomard']",184,900
Bridget Bendish,father,Henry Ireton,Who is the father of Bridget Bendish?,"['Henry Ireton', 'Lieut. Gen. Henry Ireton']",377,2866
Tanya,father,Meddler,Who is the father of Tanya?,['Meddler'],117,108
"Union State Bank, Wisconsin",country,United States of America,"In what country is Union State Bank, Wisconsin?","['United States of America', 'the United States of America', 'America', 'U.S.A.', 'USA', 'U.S.', 'US', 'the US', 'the USA', 'US of A', 'the United States', 'U. S. A.', 'U. S.', 'the States', 'the U.S.', ""'Merica"", 'U.S', 'United States', ""'Murica""]",40,1629691
Tina,country,United States of America,In what country is Tina?,"['United States of America', 'the United States of America', 'America', 'U.S.A.', 'USA', 'U.S.', 'US', 'the US', 'the USA', 'US of A', 'the United States', 'U. S. A.', 'U. S.', 'the States', 'the U.S.', ""'Merica"", 'U.S', 'United States', ""'Murica""]",50,1629691
Cave,country,Italy,In what country is Cave?,"['Italy', 'Italia', 'Italian Republic', 'IT', '🇮🇹', 'ITA']",259,403188
Dasht Jeyhun,country,Iran,In what country is Dasht Jeyhun?,"['Iran', 'Islamic Republic of Iran', 'Persia', 'ir', 'Islamic Rep. Iran', '🇮🇷']",37,317291
Baker,country,United States of America,In what country is Baker?,"['United States of America', 'the United States of America', 'America', 'U.S.A.', 'USA', 'U.S.', 'US', 'the US', 'the USA', 'US of A', 'the United States', 'U. S. A.', 'U. S.', 'the States', 'the U.S.', ""'Merica"", 'U.S', 'United States', ""'Murica""]",367,1629691
Markin,country,Iran,In what country is Markin?,"['Iran', 'Islamic Republic of Iran', 'Persia', 'ir', 'Islamic Rep. Iran', '🇮🇷']",121,317291
Imperatriz Airport,country,Brazil,In what country is Imperatriz Airport?,"['Brazil', 'Federative Republic of Brazil', 'BR', 'BRA', 'br', '🇧🇷']",337,328810
Sar Giz,country,Iran,In what country is Sar Giz?,"['Iran', 'Islamic Republic of Iran', 'Persia', 'ir', 'Islamic Rep. Iran', '🇮🇷']",36,317291
